{
  "schema_version": "1.0",
  "executive_summary": "Startup exceeds its existing threshold because a repeated Binder wait overlaps the launch-critical path.",
  "top_findings": [{"finding_id": "85000000-0000-4000-8000-000000000001", "evidence_ids": ["86000000-0000-4000-8000-000000000001"], "user_impact": "The first screen takes longer to appear."}],
  "recommendations": [{"priority": "p1", "title": "Move lookup off startup", "action": "Defer the dependency lookup until after the first frame.", "expected_effect": "Reduce launch-critical Binder wait time.", "finding_ids": ["85000000-0000-4000-8000-000000000001"], "evidence_ids": ["86000000-0000-4000-8000-000000000001"]}],
  "retest_plan": [{"mode": "verify_metric", "scenario_type": "startup", "metric_ids": ["84000000-0000-4000-8000-000000000001"], "limitation_ids": [], "steps": "Repeat cold launches and compare startup display time.", "success_condition": "meet_existing_threshold", "failure_condition": "threshold_missed"}],
  "limitations": []
}
